{
  "schema_version": "1.0.0",
  "record_id": "2d8b3a4c-1e6f-4c93-a057-4f9b1c3e6d82",
  "incident_id": "INC-2026-0918-0042",
  "in_response_to": "1c7a2f3b-0d5e-4b82-9f46-3e8a0b2d5c71",
  "timestamp": "2026-09-18T14:25:04Z",
  "actor": {
    "agent_name": "swarmops-approval-gate",
    "agent_version": "0.1.0",
    "tool_or_platform": "holmesgpt",
    "invocation_id": "holmes-run-7f3a91c4",
    "model": "claude-sonnet-5"
  },
  "action_type": "request_approval",
  "summary": "Routed the proposed v1.4.1 rollback to the sre-oncall rota for approval.",
  "target": {
    "resource_type": "k8s_deployment",
    "resource_id": "staging/checkout-api",
    "environment": "staging"
  },
  "policy_reference": {
    "policy_id": "sre-agent-policy-v3",
    "policy_description": "Autonomous agents may propose remediations but may never apply a write or production-affecting change without a recorded human approval. Proposals must state the exact command or diff to be applied.",
    "allowed_by": "rule:propose_only_no_autoremediation"
  },
  "evidence": [],
  "approver": null,
  "outcome": {
    "status": "pending",
    "details": "Approval request delivered to channel 'cli'. Awaiting decision."
  },
  "prev_record_hash": "b7f0136d9653d6551cd5fe87949e395a0fbe01883dddeef6c3d6222d7d5c8544",
  "record_hash": "875efc770e8dca0648f267cccb7c3f4a21d4b90b466a557ddbbe186b2bc5dd72"
}
